<?xml version="1.0"?>
<partite xmlns:xsi="http://www.w3.org/2001/XMLSchema-instance" xsi:noNamespaceSchemaLocation="../xml/partiteSchema.xsd"><partita><squadraCasa>Milan</squadraCasa><squadraOspite>Inter</squadraOspite><golCasa>1</golCasa><golOspite>1</golOspite><data>30/10/2023</data></partita><partita><squadraCasa>Juventus</squadraCasa><squadraOspite>Manchester United</squadraOspite><golCasa>0</golCasa><golOspite>10</golOspite><data>30/10/2023</data></partita><partita><squadraCasa>Inter</squadraCasa><squadraOspite>Real Madrid</squadraOspite><golCasa>1</golCasa><golOspite>4</golOspite><data>31/10/2021</data></partita><partita><squadraCasa>Juventus</squadraCasa><squadraOspite>Inter</squadraOspite><golCasa>1</golCasa><golOspite>3</golOspite><data>16/05/2024</data></partita></partite>
